{
  "$schema": "../../ontology/schema/scientific-intuition-flow-v2.schema.json",
  "schema_version": "scientific-intuition-flow/v2",
  "graph_id": "intuition-flow:ice",
  "title": "ICE scientific-intuition graph",
  "description": "Versioned source-linked question graph. Sidecar topics organize discussion-level ideas; optional canonical_target links are permitted only when an existing open problem has matching scope. No topic, link, or signal is a scientific claim or execution authority.",
  "updated_at_utc": "2026-09-07T14:15:18Z",
  "authority": "NON_AUTHORITATIVE_HYPOTHESIS_GENERATION",
  "canonical_graph_unchanged": true,
  "does_not_authorize_execution": true,
  "standards_alignment": [
    {
      "id": "standard:rdf11-named-graphs",
      "standard": "RDF 1.1 Concepts and Abstract Syntax",
      "uri": "https://www.w3.org/TR/rdf11-concepts/",
      "status": "W3C Recommendation",
      "boundary": "A future exchange projection may put assertion and provenance in separate named graphs; this JSON sidecar is not itself the canonical RDF graph."
    },
    {
      "id": "standard:jsonld11-exchange",
      "standard": "JSON-LD 1.1",
      "uri": "https://www.w3.org/TR/json-ld11/",
      "status": "W3C Recommendation",
      "boundary": "JSON-LD is an exchange option only; it does not confer semantics or scientific acceptance on any signal."
    },
    {
      "id": "standard:prov-o-provenance",
      "standard": "PROV-O: The PROV Ontology",
      "uri": "https://www.w3.org/TR/prov-o/",
      "status": "W3C Recommendation",
      "boundary": "Primary-source and future artifact provenance may be expressed with PROV-O; provenance records origin, not truth."
    },
    {
      "id": "standard:shacl-validation",
      "standard": "Shapes Constraint Language (SHACL)",
      "uri": "https://www.w3.org/TR/shacl/",
      "status": "W3C Recommendation",
      "boundary": "A future RDF projection requires separate SHACL shapes; this JSON sidecar uses JSON Schema plus semantic checks, and neither form of conformance is scientific evidence."
    }
  ],
  "topics": [
    {
      "id": "topic:gate1-cycle-and-orientation-methods",
      "title": "Gate-1 cycle and orientation method questions",
      "question": "Which typed ledgers and separation tests keep local saddle data distinct from a source-defined global cycle and orientation?",
      "scope": "Compatibility topic for the five v1 Gate-1 lenses; it does not alter their canonical targets or the hash-pinned v1 snapshot.",
      "non_claim": "This topic is an index, not evidence that a global cycle or orientation exists.",
      "does_not_authorize_execution": true
    },
    {
      "id": "topic:geometry-energy-unification",
      "title": "Geometry-energy unification candidate",
      "question": "Can one explicit geometric or supergeometric action derive matter-energy content and a choice-robust cross-domain observable beyond effective-fluid relabeling?",
      "scope": "Discussion-level ICE idea with no canonical CPT dependency or empirical target until a matching action and observable lane are constructed.",
      "non_claim": "This topic does not assert that curvature is energy, that modified gravity is favored, or that a canonical ICE route contains this mechanism.",
      "does_not_authorize_execution": true
    },
    {
      "id": "topic:cpt-folded-susy-synthesis",
      "title": "CPT-folded supersymmetry synthesis candidate",
      "question": "Can a temporal or internal two-sheet action keep CPT or Pin sewing distinct from a physical fermion-odd charge and derive persistent observable supersymmetry breaking?",
      "scope": "Discussion-level synthesis whose only canonical contexts are the explicitly linked Gate-4 and Gate-5 open problems; it is not a spatial far-side model.",
      "non_claim": "This topic does not assert a sheet-exchanging supercharge, a superpartner spectrum, or a discovered phenomenon.",
      "does_not_authorize_execution": true
    },
    {
      "id": "topic:local-continuum-branch-to-source-structure",
      "title": "Local continuum branch to source structure",
      "question": "What additional constrained action, composition, and gauge data would turn one local continuum branch into a candidate element source without confusing it with an original global cycle?",
      "scope": "One declared local real continuum endpoint branch and the still-open exact gauge-preserving Starobinsky element-source question. It does not select a contour, construct a BFV source, or extend the certified box.",
      "non_claim": "This topic does not assert that a locally certified root defines a Hamilton principal function, exact gauge mode, BFV source, original cycle, or global intersection.",
      "does_not_authorize_execution": true
    },
    {
      "id": "topic:boundary-amplitude-and-physical-state",
      "title": "Boundary amplitude and physical state",
      "question": "Which distinct data must pass from a classical boundary action through a globally selected amplitude and measure before a physical state or charge can be defined?",
      "scope": "Discussion-level handoff questions between the existing G1 global-cycle, G2 hard-CFU, G3 Pfaffian/Pin, and later physical-state objects. It does not identify any of those objects.",
      "non_claim": "This topic does not claim that a classical action, bosonic determinant, local root, or relative phase already defines a quantum amplitude or physical state.",
      "does_not_authorize_execution": true
    },
    {
      "id": "topic:reduced-model-versus-full-theory",
      "title": "Reduced model versus full theory",
      "question": "What distinguishes a structure in a reduced homogeneous model from a full parent theory with local modes, arbitrary-background constraints, and observables?",
      "scope": "A general parent-scope question with no scope-matched canonical target. It compares declared reduction boundaries and full-theory requirements without identifying any existing reduced result with a parent theory.",
      "non_claim": "This topic does not assert that any reduced ICE model has a unique parent, a full 3+1 completion, a low-energy limit, or an observable prediction.",
      "does_not_authorize_execution": true
    }
  ],
  "topic_links": [
    {
      "id": "intuition-link:geometry-and-folded-susy-are-distinct",
      "from": "topic:geometry-energy-unification",
      "relation": "DISTINCT_FROM",
      "to": "topic:cpt-folded-susy-synthesis",
      "rationale": "A geometric ontology and a CPT or SUSY operator algebra answer different questions and require independently typed objects.",
      "stop_condition": "Stop if shared vocabulary or diagram proximity is used as a derivation.",
      "non_claim": "This separation edge is conceptual hygiene, not evidence against a future common construction.",
      "does_not_authorize_execution": true
    },
    {
      "id": "intuition-link:common-supergeometric-action-candidate",
      "from": "topic:geometry-energy-unification",
      "relation": "MAY_SHARE_UNRESOLVED_ACTION_WITH",
      "to": "topic:cpt-folded-susy-synthesis",
      "rationale": "The lanes could meet only if one declared action derives both the geometric field content and the distinct CPT, Pin, and fermion-odd charge structures.",
      "stop_condition": "Stop if no common variational object, physical domain, degree-of-freedom inventory, or cross-domain observable is derived.",
      "non_claim": "This is an unresolved bridge question, not a dependency, equivalence, evidence edge, or theory claim.",
      "does_not_authorize_execution": true
    },
    {
      "id": "intuition-link:local-source-is-distinct-from-global-cycle",
      "from": "topic:local-continuum-branch-to-source-structure",
      "relation": "DISTINCT_FROM",
      "to": "topic:gate1-cycle-and-orientation-methods",
      "rationale": "A local constrained source construction and a source-defined global relative-cycle selection require different typed objects, even when a named branch may be an input to both questions.",
      "stop_condition": "Stop if a local branch, endpoint box, or boundary action is relabeled as a selected original cycle or global intersection vector.",
      "non_claim": "This separation is conceptual hygiene and does not deny that a future source construction could contribute to a global-cycle analysis.",
      "does_not_authorize_execution": true
    },
    {
      "id": "intuition-link:boundary-and-amplitude-may-share-action",
      "from": "topic:local-continuum-branch-to-source-structure",
      "relation": "MAY_SHARE_UNRESOLVED_ACTION_WITH",
      "to": "topic:boundary-amplitude-and-physical-state",
      "rationale": "The classical boundary and quantum-amplitude questions may share one declared variational action only if its boundary terms, gauge treatment, measure, and composition map are explicitly derived.",
      "stop_condition": "Stop if a common action is assumed from terminology alone or if a classical composition identity is treated as a quantum measure, state, or Pfaffian construction.",
      "non_claim": "This is an unresolved common-action question, not a dependency, equivalence, evidence edge, or amplitude claim.",
      "does_not_authorize_execution": true
    },
    {
      "id": "intuition-link:boundary-amplitude-is-distinct-from-cpt-susy-state",
      "from": "topic:boundary-amplitude-and-physical-state",
      "relation": "DISTINCT_FROM",
      "to": "topic:cpt-folded-susy-synthesis",
      "rationale": "A globally defined amplitude and measure are distinct from the additional common-domain, charge, constraint-closure, and persistent-spectrum requirements of a physical CPT-folded SUSY state.",
      "stop_condition": "Stop if an amplitude, determinant, relative phase, or state asymmetry alone is treated as a physical supercharge, positive state, or interacting spectrum.",